{
  "page": 1,
  "per_page": 1,
  "total": 12,
  "total_pages": 1,
  "data": [
    {
      "id": 7,
      "name": "morpheus",
      "year": 13,
      "color": "#5cae31",
      "pantone_value": "17-1456"
    },
    {
      "id": 7,
      "name": "morpheus",
      "year": 88,
      "color": "#5cae31",
      "pantone_value": "17-1456"
    }
  ],
  "support": {}
}